title,year,original_release_date_parsed,domestic_gross,international_gross,worldwide_gross,production_budget,profit_proxy,roi_proxy,tomatometer_rating,tomatometer_count,genres,runtime,directors,lead_actor,lead_actor_has_oscar,lead_actor_tier,lead_actor_status,star_power_score,is_animated,is_live_action,is_franchise,is_sequel,is_standalone,lead_actor_clean
Game Night,2018,2018-02-23,69179066,48500000,117679066,18501009,99178057,5.360683679,85,252,"Comedy, Mystery & Suspense",100,"Jonathan M. Goldstein, John Francis Daley",Jason Bateman Rachel McAdams Billy Magnussen Sharon Horgan Lamorne Morris,0,C,trending,38.23734729,0,1,0,0,1,jason bateman rachel mcadams billy magnussen sharon horgan lamorne morris
The Monkey King 3,2018,2018-02-16,187074,114897502,115084576,250000001.5,-134915425.5,-0.5396616988,33,6,"Action & Adventure, Science Fiction & Fantasy",116,Pou-Soi Cheang,Aaron Kwok  Feng Shaofeng Xiaoshenyang Lin Chi-ling Him Law,0,C,trending,38.11518325,0,1,0,1,0,aaron kwok  feng shaofeng xiaoshenyang lin chi-ling him law
First Man,2018,2018-10-12,44936545,60760870,105697415,29501009,76196406,2.582840675,86,444,Drama,141,Damien Chazelle,Ryan Gosling Jason Clarke Patrick Fugit James R. Hansen Connor Blodgett,0,C,trending,36.40488656,0,1,0,0,1,ryan gosling jason clarke patrick fugit james r. hansen connor blodgett
Book Club,2018,2018-05-18,68566296,35871892,104438188,14000000,90438188,6.459870571,54,184,Comedy,104,Bill Holderman,Diane Keaton Jane Fonda Candice Bergen Mary Steenburgen Andy Garcia,0,C,trending,36.03839442,0,1,0,0,1,diane keaton jane fonda candice bergen mary steenburgen andy garcia
Night School,2018,2018-09-28,77339130,25766748,103105878,29000000,74105878,2.555375103,26,140,Comedy,111,Malcolm D. Lee,Kevin Hart Tiffany Haddish Rob Riggle Romany Malco Megalyn Echikunwoke,0,C,trending,35.91623037,0,1,0,0,1,kevin hart tiffany haddish rob riggle romany malco megalyn echikunwoke
A Simple Favor,2018,2018-09-14,53548586,44096031,97644617,20000000,77644617,3.88223085,84,247,Mystery & Suspense,117,Paul Feig,Anna Kendrick Blake Lively Henry Golding Nicole Peters Ava LaFramboise Linda Cardellini,0,C,trending,34.93891798,0,1,0,0,1,anna kendrick blake lively henry golding nicole peters ava laframboise linda cardellini
Alpha,2018,2018-08-17,35857181,61397147,97254328,51000000,46254328,0.9069476078,80,132,"Action & Adventure, Drama, Mystery & Suspense",97,Albert Hughes,Kodi Smit-McPhee Jóhannes Haukur Jóhannesson Natassia Malthe Leonor Varela Spencer Bogaert,0,C,trending,34.69458988,0,1,0,0,1,kodi smit-mcphee jóhannes haukur jóhannesson natassia malthe leonor varela spencer bogaert
The Favourite,2018,2018-11-23,34366783,61551923,95918706,15000000,80918706,5.3945804,93,405,Drama,120,Yorgos Lanthimos,Olivia Colman Emma Stone Rachel Weisz Nicholas Hoult Joe Alwyn,0,C,trending,34.45026178,0,1,0,0,1,olivia colman emma stone rachel weisz nicholas hoult joe alwyn
I Feel Pretty,2018,2018-04-20,48795601,45743825,94539426,32000000,62539426,1.954357063,35,226,Comedy,110,"Abby Kohn, Marc Silverstein",Amy Schumer Michelle Williams Busy Philipps Rory Scovel Emily Ratajkowski,0,C,trending,34.20593368,0,1,0,0,1,amy schumer michelle williams busy philipps rory scovel emily ratajkowski
Blockers,2018,2018-04-06,60311495,33705799,94017294,21000000,73017294,3.477014,84,225,Comedy,102,Kay Cannon,Ike Barinholtz John Cena Geraldine Viswanathan Kathryn Newton Gideon Adlon,0,C,trending,33.59511344,0,1,0,0,1,ike barinholtz john cena geraldine viswanathan kathryn newton gideon adlon
BlacKkKlansman,2018,2018-08-10,49275340,44125483,93400823,15000000,78400823,5.226721533,96,436,"Comedy, Drama",134,Spike Lee,John David Washington Adam Driver Topher Grace Laura Harrier Jasper Pääkkönen,0,C,trending,33.47294939,0,1,0,0,1,john david washington adam driver topher grace laura harrier jasper pääkkönen
Goosebumps 2: Haunted Halloween,2018,2018-10-12,46700633,46619747,93320380,17500001,75820379,4.332592838,47,95,"Comedy, Horror, Kids & Family",90,Ari Sandel,Jeremy Ray Taylor Jack Black Madison Iseman Caleel Harris,0,C,trending,33.35078534,0,1,0,1,0,jeremy ray taylor jack black madison iseman caleel harris
Overboard,2018,2018-05-04,50316123,40928790,91244913,12000000,79244913,6.60374275,24,89,"Comedy, Romance",112,Rob Greenberg,Eugenio Derbez Anna Faris Eva Longoria Payton Lepinski John Hannah,0,C,trending,32.61780105,0,1,0,0,1,eugenio derbez anna faris eva longoria payton lepinski john hannah
Sherlock Gnomes,2018,2018-03-23,43242871,47254907,90497778,59000000,31497778,0.5338606441,27,66,"Action & Adventure, Animation, Comedy, Kids & Family",86,John Stevenson,Johnny Depp Emily Blunt Chiwetel Ejiofor Michael Caine Kelly Asbury,0,C,trending,32.37347295,1,0,0,0,1,johnny depp emily blunt chiwetel ejiofor michael caine kelly asbury
Robin Hood,2018,2018-11-21,30824628,55664403,86489031,50001009,36488022,0.7297457137,15,165,"Action & Adventure, Drama",118,Otto Bathurst,Taron Egerton Jamie Foxx Jamie Dornan Eve Hewson Ben Mendelsohn,0,C,trending,32.0069808,0,1,0,0,1,taron egerton jamie foxx jamie dornan eve hewson ben mendelsohn
I Can Only Imagine,2018,2018-03-16,83482352,2604529,86086881,7000000,79086881,11.29812586,63,32,"Drama, Kids & Family",110,"Jon Erwin, Andrew Erwin",Dennis Quaid Amy Grant Kevin Downes Trace Adkins Kelli Caldwell,0,C,trending,31.76265271,0,1,0,0,1,dennis quaid amy grant kevin downes trace adkins kelli caldwell
Mortal Engines,2018,2018-12-14,15951040,67721633,83672673,100000000,-16327327,-0.16327327,26,186,"Action & Adventure, Science Fiction & Fantasy",128,Christian Rivers,Robert Sheehan Hera Hilmar Hugo Weaving Leila George Stephen Lang,0,C,trending,31.02966841,0,1,0,0,1,robert sheehan hera hilmar hugo weaving leila george stephen lang
Den of Thieves,2018,2018-01-19,44947622,35562000,80509622,30000000,50509622,1.683654067,41,135,"Action & Adventure, Drama",140,Christian Gudegast,Gerard Butler O'Shea Jackson Jr. 50 Cent Pablo Schreiber Meadow Williams,0,C,trending,30.41884817,0,1,0,0,1,gerard butler o'shea jackson jr. 50 cent pablo schreiber meadow williams
Hereditary,2018,2018-06-08,44069456,35926845,79996301,1000000,78996301,78.996301,89,371,"Drama, Horror",127,Ari Aster,Toni Collette Alex Wolff Milly Shapiro Gabriel Byrne Mallory Bechtel,0,C,trending,30.29668412,0,1,0,0,1,toni collette alex wolff milly shapiro gabriel byrne mallory bechtel
Tag,2018,2018-06-15,54730625,23500000,78230625,28000000,50230625,1.793950893,56,200,Comedy,100,Jeff Tomsic,Jeremy Renner Jon Hamm Ed Helms Isla Fisher Annabelle Wallis,0,C,trending,29.44153578,0,1,0,0,1,jeremy renner jon hamm ed helms isla fisher annabelle wallis
Vice,2018,2018-12-25,47836282,28237206,76073488,60000000,16073488,0.2678914667,65,359,Drama,132,Adam McKay,Christian Bale Steve Carrel Tyler Perry Sam Rockwell Lily Rabe,0,C,trending,28.95287958,0,1,0,0,1,christian bale steve carrel tyler perry sam rockwell lily rabe
Widows,2018,2018-11-16,42402632,33582068,75984700,21001009,54983691,2.618145204,91,411,Drama,128,Steve McQueen (III),Viola Davis Liam Neeson Elizabeth Debicki Michelle Rodriguez Colin Farrell,0,C,trending,28.83071553,0,1,0,0,1,viola davis liam neeson elizabeth debicki michelle rodriguez colin farrell
Sicario: Day of the Soldado,2018,2018-06-29,50072235,25765508,75837743,35000000,40837743,1.166792657,62,285,"Action & Adventure, Drama",122,Stefano Sollima,Benicio del Toro Josh Brolin Isabela Merced Jeffrey Donovan Manuel Garcia-Rulfo,0,C,trending,28.70855148,0,1,0,0,1,benicio del toro josh brolin isabela merced jeffrey donovan manuel garcia-rulfo
Searching,2018,2018-08-31,26020957,49441080,75462037,880000,74582037,84.75231477,92,248,Mystery & Suspense,102,Aneesh Chaganty,John Cho Michelle La Debra Messing Briana McLean Sara Sohn,0,C,trending,28.46422339,0,1,0,0,1,john cho michelle la debra messing briana mclean sara sohn
The Spy Who Dumped Me,2018,2018-08-03,33562069,41758611,75320680,40000000,35320680,0.883017,49,206,"Action & Adventure, Comedy",116,Susanna Fogel,Mila Kunis Kate McKinnon Sam Heughan Justin Theroux Ivanna Sakhno,0,C,trending,28.34205934,0,1,0,0,1,mila kunis kate mckinnon sam heughan justin theroux ivanna sakhno
Second Act,2018,2018-12-21,39282227,33000000,72282227,16000000,56282227,3.517639188,44,110,"Comedy, Romance",104,Peter Segal,Jennifer Lopez Milo Ventimiglia Vanessa Hudgens Leah Remini Dan Bucatinsky,0,C,trending,27.73123909,0,1,0,0,1,jennifer lopez milo ventimiglia vanessa hudgens leah remini dan bucatinsky
12 Strong,2018,2018-01-19,45819713,21539477,67359190,35000000,32359190,0.9245482857,50,171,"Action & Adventure, Drama",130,Nicolai Fuglsig,Chris Hemsworth Michael Peña Michael Shannon William Fichtner Thad Luckinbill,0,C,trending,26.9982548,0,1,0,0,1,chris hemsworth michael peña michael shannon william fichtner thad luckinbill
"Love, Simon",2018,2018-03-16,40826341,25489948,66316289,17000000,49316289,2.900958176,91,229,Drama,110,Greg Berlanti,Nick Robinson Keiynan Lonsdale Katherine Langford Josh Duhamel Jennifer Garner,0,C,trending,26.63176265,0,1,0,0,1,nick robinson keiynan lonsdale katherine langford josh duhamel jennifer garner
Mile 22,2018,2018-08-17,36108758,30200000,66308758,25000011,41308747,1.652349153,23,189,Action & Adventure,95,Peter Berg,Mark Wahlberg Peter Berg Iko Uwais Lauren Cohan John Malkovich,0,C,trending,26.5095986,0,1,0,0,1,mark wahlberg peter berg iko uwais lauren cohan john malkovich
Life of the Party,2018,2018-05-11,53059911,12600000,65659911,30000000,35659911,1.1886637,38,151,Comedy,105,Ben Falcone,Melissa McCarthy Deanna Miles  Matt Walsh Molly Gordon Jacki Weaver,0,C,trending,26.26527051,0,1,0,0,1,melissa mccarthy deanna miles  matt walsh molly gordon jacki weaver
Isle of Dogs,2018,2018-04-13,32015231,32226268,64241499,35000000,29241499,0.8354714,90,358,"Action & Adventure, Animation, Comedy",101,Wes Anderson,Bill Murray Edward Norton Bryan Cranston Tilda Swinton Jeff Goldblum,0,C,trending,25.89877836,1,0,0,0,1,bill murray edward norton bryan cranston tilda swinton jeff goldblum
Adrift,2018,2018-06-01,31445012,28500000,59945012,17501009,42444003,2.425231768,69,197,"Drama, Romance",120,Baltasar Kormákur,Shailene Woodley Sam Claflin Tami Oldham Ashcraft Grace Palmer Elizabeth Hawthorne,0,C,trending,23.57766143,0,1,0,0,1,shailene woodley sam claflin tami oldham ashcraft grace palmer elizabeth hawthorne
The 15:17 to Paris,2018,2018-02-09,36276286,20900000,57176286,30000000,27176286,0.9058762,23,165,Drama,94,Clint Eastwood,Spencer Stone Jenna Fischer Camille Razat Judy Greer Jaleel White,0,C,trending,23.08900524,0,1,0,0,1,spencer stone jenna fischer camille razat judy greer jaleel white
Early Man,2018,2018-02-16,8267544,46355270,54622814,50000000,4622814,0.09245628,80,174,"Animation, Comedy, Kids & Family",89,Nick Park,Nick Park Eddie Redmayne Tom Hiddleston Maise Williams Richard Ayoade,0,C,trending,22.11169284,1,0,0,0,1,nick park eddie redmayne tom hiddleston maise williams richard ayoade
Peppermint,2018,2018-09-07,35418723,18500000,53918723,12501009,41417714,3.313149683,12,144,"Action & Adventure, Mystery & Suspense",102,Pierre Morel,Jennifer Garner Cailey Fleming Erin Carufel John Ortiz Richard Cabral,0,C,trending,21.86736475,0,1,0,0,1,jennifer garner cailey fleming erin carufel john ortiz richard cabral
Teen Titans GO! To the Movies,2018,2018-07-27,29790236,22600000,52390236,10000000,42390236,4.2390236,91,132,"Action & Adventure, Animation, Kids & Family",87,"Aaron Horvath, Peter Rida Michail",Greg Cipes Scott Menville Hynden Walch Khary Payton Kristen Bell,0,C,trending,21.2565445,1,0,0,0,1,greg cipes scott menville hynden walch khary payton kristen bell
Slender Man,2018,2018-08-10,30569484,21169065,51738549,10000000,41738549,4.1738549,8,79,Horror,93,Sylvain White,Javier Botet Jaz Sinclair Alex Fitzalan Taylor Richardson Jessica Blank,0,C,trending,21.0122164,0,1,0,0,1,javier botet jaz sinclair alex fitzalan taylor richardson jessica blank
Breaking In,2018,2018-05-11,46840590,4571030,51411620,3001009,48410611,16.13144479,27,107,Mystery & Suspense,88,James McTeigue,Gabrielle Union Billy Burke Richard Cabral Ajiona Alexus Seth Carr,0,C,trending,20.76788831,0,1,0,0,1,gabrielle union billy burke richard cabral ajiona alexus seth carr
Death Wish,2018,2018-03-02,34017028,15545682,49562710,30000000,19562710,0.6520903333,18,161,"Action & Adventure, Drama, Mystery & Suspense",107,Eli Roth,Bruce Willis Elisabeth Shue Vincent D'Onofrio Camila Morrone Kimbrely Elise,0,C,trending,20.40139616,0,1,0,0,1,bruce willis elisabeth shue vincent d'onofrio camila morrone kimbrely elise
Mary Queen of Scots,2018,2018-12-07,16468499,30244310,46712809,25000000,21712809,0.86851236,62,282,Drama,124,Josie Rourke,Margot Robbie Jack Lowden Guy Pearce James McArdle Saoirse Ronan,0,C,trending,18.44677138,0,1,0,0,1,margot robbie jack lowden guy pearce james mcardle saoirse ronan
Uncle Drew,2018,2018-06-29,42469946,4194468,46664414,18500000,28164414,1.522400757,61,97,Comedy,104,Charles Stone III,Kyrie Irving Lil Rel Howery Shaquille O'Neal Erica Ash Tiffany Haddish,0,C,trending,18.32460733,0,1,0,0,1,kyrie irving lil rel howery shaquille o'neal erica ash tiffany haddish
Winchester,2018,2018-02-02,25091816,18927772,44019588,3500000,40519588,11.57702514,13,130,"Drama, Mystery & Suspense, Science Fiction & Fantasy",99,"Michael Spierig, Peter Spierig",Helen Mirren Jason Clarke Finn Scicluna-O'Prey Phoenix Suhrou-Dimarco Red Horse Rivera,0,C,trending,17.10296684,0,1,0,0,1,helen mirren jason clarke finn scicluna-o'prey phoenix suhrou-dimarco red horse rivera
Annihilation,2018,2018-02-23,32732301,10338614,43070915,27501009,15569906,0.5661576272,88,313,"Action & Adventure, Drama, Science Fiction & Fantasy",115,Alex Garland,Natalie Portman Oscar Isaac Jennifer Jason Leigh Tessa Thompson Gina Rodriguez,0,C,trending,16.36998255,0,1,0,0,1,natalie portman oscar isaac jennifer jason leigh tessa thompson gina rodriguez
The Possession of Hannah Grace,2018,2018-11-30,14837422,28179106,43016528,7700000,35316528,4.586562078,18,55,"Horror, Mystery & Suspense",85,Diederik Van Rooijen,Kirby Johnson Shay Mitchell Grey Damon Stana Katic Matt Mings,0,C,trending,16.12565445,0,1,0,0,1,kirby johnson shay mitchell grey damon stana katic matt mings
Overlord,2018,2018-11-09,21704844,19953000,41657844,38000000,3657844,0.09625905263,81,221,"Action & Adventure, Horror, Mystery & Suspense",110,Julius Avery,Mathilde Ollivier Jovan Adepo Wyatt Russell John Magaro Pilou Asbæk,0,C,trending,15.27050611,0,1,0,0,1,mathilde ollivier jovan adepo wyatt russell john magaro pilou asbæk
The Darkest Minds,2018,2018-08-03,12695691,28446688,41142379,34000000,7142379,0.2100699706,16,140,"Mystery & Suspense, Science Fiction & Fantasy",104,Jennifer Yuh Nelson,Will Arnett Natasha Lyonn Gabriel Iglesias Omar Chaparro Ludacris,0,C,trending,14.65968586,0,1,0,0,1,will arnett natasha lyonn gabriel iglesias omar chaparro ludacris
Show Dogs,2018,2018-05-18,17857020,21299834,39156854,5500000,33656854,6.119428,16,63,"Comedy, Kids & Family",92,Raja Gosnell,Amandla Stenberg Harris Dickinson Skylan Brooks Miya Cech Mandy Moore,0,C,trending,13.43804538,0,1,0,0,1,amandla stenberg harris dickinson skylan brooks miya cech mandy moore
The Girl in the Spider's Web,2018,2018-11-09,14841338,20323582,35164920,43000000,-7835080,-0.1822111628,39,236,Drama,117,Fede Alvarez,Claire Foy Sverrir Guðnason Sylvia Hoeks Stephen Merchant,0,C,trending,11.72774869,0,1,0,0,1,claire foy sverrir guðnason sylvia hoeks stephen merchant
The Hate U Give,2018,2018-10-19,29719483,5214526,34934009,23000000,11934009,0.5188699565,97,220,Drama,133,George Tillman Jr.,Amandla Stenberg Regina Hall KJ Apa Sabrina Carpenter Russel Hornsby,0,C,trending,11.60558464,0,1,0,0,1,amandla stenberg regina hall kj apa sabrina carpenter russel hornsby
Nobody's Fool,2018,2018-11-02,31713110,1992223,33705333,19000000,14705333,0.7739648947,24,42,Comedy,110,Tyler Perry,Tiffany Haddish Tika Sumpter Whoopi Goldberg Omari Hardwick Amber Riley,0,C,trending,10.7504363,0,1,0,0,1,tiffany haddish tika sumpter whoopi goldberg omari hardwick amber riley
The Hurricane Heist,2018,2018-03-09,6115825,26401423,32517248,35000000,-2482752,-0.07093577143,47,59,"Action & Adventure, Drama, Mystery & Suspense",103,Rob Cohen,Maggie Grace Toby Kebbell Melissa Bolona Ryan Kwaten,0,C,trending,10.2617801,0,1,0,0,1,maggie grace toby kebbell melissa bolona ryan kwaten
Bad Times at the El Royale,2018,2018-10-12,17839115,14043609,31882724,32000000,-117276,-0.003664875,74,250,Mystery & Suspense,141,Drew Goddard,Jeff Bridges Jon Hamm Chris Hemsworth Dakota Johnson Lewis Pullman,0,C,trending,9.65095986,0,1,0,0,1,jeff bridges jon hamm chris hemsworth dakota johnson lewis pullman
Hunter Killer,2018,2018-10-26,15767460,15905218,31672678,40000000,-8327322,-0.20818305,36,110,"Action & Adventure, Drama, Mystery & Suspense",121,Donovan Marsh,Gerald Butler Gary Oldman Michael Nyqvist Linda Cardellini,0,C,trending,9.406631763,0,1,0,0,1,gerald butler gary oldman michael nyqvist linda cardellini
Super Troopers 2,2018,2018-04-20,30617396,1008990,31626386,6750001,24876385,3.685389824,36,98,Comedy,103,Jay Chandrasekhar,Jay Chandrasekhar Kevin Heffernan Steve Lemme Paul Soter Erik Stolhanske,0,C,trending,9.162303665,0,1,0,1,0,jay chandrasekhar kevin heffernan steve lemme paul soter erik stolhanske
The Strangers: Prey at Night,2018,2018-03-09,24586708,6452418,31039126,5000000,26039126,5.2078252,39,122,Horror,85,Johannes Roberts,Bailee Madison Lewis Pullman Christina Hendricks Martin Henderson Emma Bellomy,0,C,trending,9.040139616,0,1,0,0,1,bailee madison lewis pullman christina hendricks martin henderson emma bellomy
Free Solo,2018,2018-09-28,17541090,11849189,29390279,2000000,27390279,13.6951395,97,153,Documentary,100,"Elizabeth Chai Vasarhelyi, Jimmy Chin",Alex Honnold Jimmy Chin Tommy Caldwell Dean Potter Sanni McCandless,0,C,trending,7.57417103,0,1,0,0,1,alex honnold jimmy chin tommy caldwell dean potter sanni mccandless
Mirai,2018,2018-11-29,812794,27944167,28756961,6726792,22030169,3.27498888,90,83,"Animation, Anime & Manga, Art House & International, Kids & Family",98,Mamoru Hosoda,Rebecca Hall John Cho Daniel Dae Kim Moka Kamishiraishi Jaden Waldman,0,C,trending,7.329842932,1,0,0,0,1,rebecca hall john cho daniel dae kim moka kamishiraishi jaden waldman
The Happytime Murders,2018,2018-08-24,20706452,6800000,27506452,40000000,-12493548,-0.3123387,23,243,"Action & Adventure, Comedy",91,Brian Henson,Melissa McCarthy Brian Henson Maya Rudolph Elizabeth Banks Ben Falcone,0,C,trending,6.47469459,0,1,0,0,1,melissa mccarthy brian henson maya rudolph elizabeth banks ben falcone
Midnight Sun,2018,2018-03-23,9561064,17804403,27365467,2800000,24565467,8.773381071,21,61,"Drama, Romance",91,Scott Speer,"Bella Thorne Patrick Schwarzenegger QuinnShephard Rob Riggle Ava Dewhurst
 ",0,C,trending,6.230366492,0,1,0,0,1,bella thorne patrick schwarzenegger quinnshephard rob riggle ava dewhurst
White Boy Rick,2018,2018-09-14,24011188,1946294,25957482,29000000,-3042518,-0.1049144138,58,153,Drama,111,Yann Demange,"Richie Merritt Matthew McConaughey Bel Powey Jennifer Jason Leigh Jonathan Majors
",0,C,trending,5.008726003,0,1,0,0,1,richie merritt matthew mcconaughey bel powey jennifer jason leigh jonathan majors
"Paul, Apostle of Christ",2018,2018-03-23,17560475,8355491,25915966,5000000,20915966,4.1831932,46,39,Drama,108,Andrew Hyatt,Jim Caviezel James Faulkner Olivier Martinez Joanne Whalley Alessandra Williams,0,C,trending,4.764397906,0,1,0,0,1,jim caviezel james faulkner olivier martinez joanne whalley alessandra williams
Pokémon the Movie: The Power of Us,2018,2018-11-24,789170,22951618,23740788,30000000,-6259212,-0.2086404,71,7,Special Interest,113,Tetsuo Yajima,Jimmy Zoppi Sarah Natochenny Ikue Ōtani Lisa Ortiz Haven Paschall,0,C,trending,3.420593368,0,1,0,0,1,jimmy zoppi sarah natochenny ikue ōtani lisa ortiz haven paschall
The Guernsey Literary and Potato Peel Pie Society,2018,2018-04-20,0,23148937,23148937,85000000,-61851063,-0.7276595647,80,71,Drama,124,Mike Newell,Lily James Jessica Brown Findlay Matthew Goode Michiel Huisman Penelope Wilton,0,C,trending,2.443280977,0,1,0,0,1,lily james jessica brown findlay matthew goode michiel huisman penelope wilton
Won't You Be My Neighbor?,2018,2018-06-08,22835787,8954,22844741,28000000,-5155259,-0.1841163929,97,249,Documentary,94,Morgan Neville,Fred Rogers Joane Rogers Tom Junod Hedda Sharapan David Newell,0,C,trending,1.954624782,0,1,0,0,1,fred rogers joane rogers tom junod hedda sharapan david newell
Avengers: Endgame,2019,2019-04-26,858373000,1941066100,2799439100,200000178,2599438922,12.99718304,94,528,"Action & Adventure, Drama, Science Fiction & Fantasy",181,Anthony Russo,Robert Downey Jr Chris Evans Chris Hemsworth Mark Ruffalo Scarlett Johansson Josh Brolin,0,A,trending,70,0,1,1,0,0,robert downey jr chris evans chris hemsworth mark ruffalo scarlett johansson josh brolin
The Lion King,2019,2019-07-19,543638043,1113305351,1656943394,130001009.5,1526942385,11.74561944,52,424,"Action & Adventure, Animation, Drama",118,Jon Favreau,James Earl Jones Beyonce Donald Glover Chiwetel Ejiofor Seth Rogen,0,A,trending,69.5113438,1,0,0,0,1,james earl jones beyonce donald glover chiwetel ejiofor seth rogen
Frozen II,2019,2019-11-21,477373578,972653355,1450026933,1500000000,-49973067,-0.033315378,77,325,"Action & Adventure, Animation, Comedy, Kids & Family",103,"Jennifer Lee, Chris Buck",Kristen Bell Idina Menzel Jonathan Groff Josh Gad Evan Rachel Wood,0,A,trending,69.26701571,1,0,0,1,0,kristen bell idina menzel jonathan groff josh gad evan rachel wood
Spider-Man: Far from Home,2019,2019-07-02,390532085,741395911,1131927996,160000000,971927996,6.074549975,90,441,"Action & Adventure, Science Fiction & Fantasy",129,Jon Watts,Tom Holland Zendaya Jake Gyllenhaal Jacob Batalon Marisa Tomei,0,A,trending,68.16753927,0,1,1,0,0,tom holland zendaya jake gyllenhaal jacob batalon marisa tomei
Captain Marvel,2019,2019-03-08,426829839,701444955,1128274794,152000000,976274794,6.422860487,79,523,"Action & Adventure, Science Fiction & Fantasy",124,"Anna Boden, Ryan Fleck",Brie Larson Samuel L Jackson Gemma Chan Jude Law Ben Mendelsohn,0,A,trending,68.04537522,0,1,1,0,0,brie larson samuel l jackson gemma chan jude law ben mendelsohn
Joker,2019,2019-10-04,335451311,743300000,1078751311,55000000,1023751311,18.6136602,68,574,"Action & Adventure, Drama, Mystery & Suspense",122,Todd Phillips,Joaquin Phoenix Robert De Niro Zazie Beetz Glenn Fleshler Marc Maron,0,A,trending,67.92321117,0,1,0,0,1,joaquin phoenix robert de niro zazie beetz glenn fleshler marc maron
Toy Story 4,2019,2019-06-21,434038008,639356585,1073394593,100000002,973394591,9.733945715,97,443,"Animation, Comedy, Kids & Family, Science Fiction & Fantasy",100,Josh Cooley,Tom Hanks Tim Allen Keanue Reeves Tony Hale Annie Potts,0,A,trending,67.80104712,1,0,0,1,0,tom hanks tim allen keanue reeves tony hale annie potts
Aladdin,2019,2019-05-24,355559216,695134737,1050693953,183000000,867693953,4.741497011,57,370,"Action & Adventure, Kids & Family, Science Fiction & Fantasy",128,Guy Ritchie,Will Smith Mena Massoud Naomi Scott Marwan Kenzari Nasim Pedrad,0,A,trending,67.55671902,0,1,0,0,1,will smith mena massoud naomi scott marwan kenzari nasim pedrad
Jumanji: The Next Level,2019,2019-12-13,320314960,481378969,801693929,125000000,676693929,5.413551432,72,240,"Action & Adventure, Comedy",123,Jake Kasdan,Dwayne Johnson Kevin Hart Jack Black Karen Gillan Nick Jonas,0,A,well_known,69.7556719,0,1,0,0,1,dwayne johnson kevin hart jack black karen gillan nick jonas
Fast & Furious Presents: Hobbs & Shaw,2019,2019-08-02,173956935,586775991,760732926,200000000,560732926,2.80366463,67,337,"Action & Adventure, Mystery & Suspense",138,David Leitch,Dwayne Johnson Jason Statham Idris Elba Vanessa Kirby Roman Reign,0,A,trending,65.23560209,0,1,1,0,0,dwayne johnson jason statham idris elba vanessa kirby roman reign
Ne Zha,2019,2019-08-29,3695533,722329335,726024868,20000000,706024868,35.3012434,88,17,"Action & Adventure, Animation, Science Fiction & Fantasy",110,Yu Yang,Griffin Puatu Aleks Le Yanting Lü Mike Pollock Joseph Cao,0,A,trending,64.86910995,1,0,0,0,1,griffin puatu aleks le yanting lü mike pollock joseph cao
How to Train Your Dragon: The Hidden World,2019,2019-02-22,160799505,361000000,521799505,129000000,392799505,3.044957403,90,263,"Action & Adventure, Animation, Kids & Family",104,Dean DeBlois,Jay Baruchel America Ferrera Gerakd Butler Kit Harrington Kristen Wiig,0,B,trending,61.93717277,1,0,0,0,1,jay baruchel america ferrera gerakd butler kit harrington kristen wiig
Maleficent: Mistress of Evil,2019,2019-10-18,113929605,377800484,491730089,185000000,306730089,1.658000481,40,251,"Action & Adventure, Science Fiction & Fantasy",118,Joachim Rønning,Angelina Jolie Elle Fanning Michelle Pfeiffer Ed Skrein Harris Dickinson,0,B,trending,61.44851658,0,1,0,0,1,angelina jolie elle fanning michelle pfeiffer ed skrein harris dickinson
It Chapter Two,2019,2019-09-06,211593228,261500000,473093228,79000000,394093228,4.988521873,63,367,Horror,169,Andy Muschietti,Bill Hader Jessica Chastain James McAvoy Bill Skarsgård  James Ransone,0,B,trending,60.95986038,0,1,0,0,1,bill hader jessica chastain james mcavoy bill skarsgård  james ransone
The Secret Life of Pets 2,2019,2019-06-07,158980250,272184209,431164459,40000001,391164458,9.779111206,60,159,"Animation, Comedy",86,"Chris Renaud, Jonathan Del Val",Kevin Hart Chris Renaud Harrison Ford Patton Oswalt Jenny Slate,0,B,trending,60.10471204,1,0,0,1,0,kevin hart chris renaud harrison ford patton oswalt jenny slate
The Captain,2019,2019-10-18,706572,417156973,417863545,180000000,237863545,1.321464139,75,8,"Action & Adventure, Drama",111,Wai-keung Lau,Meng Ziyi Hanyu Zhang Li Xian Angelababy Li Qin,0,B,trending,59.7382199,0,1,0,0,1,meng ziyi hanyu zhang li xian angelababy li qin
