title,year,original_release_date_parsed,domestic_gross,international_gross,worldwide_gross,production_budget,profit_proxy,roi_proxy,tomatometer_rating,tomatometer_count,genres,runtime,directors,lead_actor,lead_actor_has_oscar,lead_actor_tier,lead_actor_status,star_power_score,is_animated,is_live_action,is_franchise,is_sequel,is_standalone,lead_actor_clean
Star Wars: Episode VII - The Force Awakens,2015,2015-12-18,936662225,1131561399,2068223624,533000000,1535223624,2.88034451,92,437,"Action & Adventure, Science Fiction & Fantasy",136,J.J. Abrams,Daisy Ridley John Boyega Harrison Ford Oscar Issac Adam Driver,0,A,well_known,69.87783595,0,1,1,1,0,daisy ridley john boyega harrison ford oscar issac adam driver
Jurassic World,2015,2015-06-12,652270625,1018130012,1670400637,150000000,1520400637,10.13600425,70,351,"Action & Adventure, Mystery & Suspense, Science Fiction & Fantasy",124,Colin Trevorrow,Chris Pratt Bryce Dallas Howard Irrfan Khan Vincent D'Onofrio Nick Robinson,0,A,well_known,69.63350785,0,1,1,0,0,chris pratt bryce dallas howard irrfan khan vincent d'onofrio nick robinson
Furious 7,2015,2015-04-03,353007020,1162040651,1515047671,190000000,1325047671,6.973935111,82,272,"Action & Adventure, Mystery & Suspense",137,James Wan,Vin Diesel Paul Walker Dwayne Johnson Michelle Rodriguez Tyrese Gibson,0,A,well_known,69.38917976,0,1,0,1,0,vin diesel paul walker dwayne johnson michelle rodriguez tyrese gibson
Avengers: Age of Ultron,2015,2015-05-01,459005868,943800000,1402805868,280000000,1122805868,4.010020957,76,367,"Action & Adventure, Science Fiction & Fantasy",141,Joss Whedon,Robert Downey Jr. Chris Hemsworth Mark Ruffalo Chris Evans Scarlett Johansson,0,A,well_known,69.14485166,0,1,1,0,0,robert downey jr. chris hemsworth mark ruffalo chris evans scarlett johansson
Minions,2015,2015-07-10,336045770,823352627,1159398397,74000000,1085398397,14.66754591,55,221,"Animation, Comedy, Kids & Family",91,"Pierre Coffin, Kyle Balda",Sandra Bullock Jon Hamm Michael Keaton Allison Janney Steve Coogan,0,A,well_known,68.41186736,1,0,0,0,1,sandra bullock jon hamm michael keaton allison janney steve coogan
Spectre,2015,2015-11-06,200074609,680600000,880674609,245000000,635674609,2.594590241,63,359,Action & Adventure,148,Sam Mendes,Daniel Craig Christoph Waltz L\u00e9a Seydoux Ralph Fiennes Monica Bellucci,0,A,well_known,66.82373473,0,1,0,0,1,daniel craig christoph waltz l\u00e9a seydoux ralph fiennes monica bellucci
Inside Out,2015,2015-06-19,356461711,501832719,858294430,175000000,683294430,3.9045396,98,370,"Animation, Kids & Family",95,"Pete Docter, Ronnie del Carmen",Amy Poehler Phyllis Smith Richard Kind Bill Hader Lewis Black,0,A,well_known,66.21291449,1,0,0,0,1,amy poehler phyllis smith richard kind bill hader lewis black
The Hunger Games: Mockingjay - Part 2,2015,2015-11-20,281723902,371704359,653428261,160000000,493428261,3.083926631,69,288,"Action & Adventure, Drama, Science Fiction & Fantasy",136,Francis Lawrence,Jennifer Lawrence Josh Hutcherson Liam Hemsworth Woody Harrelson Elizabeth Banks,0,A,well_known,64.2582897,0,1,0,1,0,jennifer lawrence josh hutcherson liam hemsworth woody harrelson elizabeth banks
The Martian,2015,2015-10-02,228433663,401728227,630161890,108000000,522161890,4.834832315,91,374,Science Fiction & Fantasy,142,Ridley Scott,Matt Damon Jessica Chastain Kristen Wiig Jeff Daniels Michael Pe\u00f1a,0,A,well_known,63.89179756,0,1,0,0,1,matt damon jessica chastain kristen wiig jeff daniels michael pe\u00f1a
Fifty Shades of Grey,2015,2015-02-13,166167230,403484237,569651467,40000000,529651467,13.24128668,25,280,Romance,125,Sam Taylor-Johnson,Dakota Johnson Jamie Dornan Jennifer Ehle Eloise Mumford Victor Rasuk,0,A,well_known,63.15881326,0,1,0,0,1,dakota johnson jamie dornan jennifer ehle eloise mumford victor rasuk
Cinderella,2015,2015-03-13,201151353,341200000,542351353,95000000,447351353,4.708961611,84,246,"Kids & Family, Science Fiction & Fantasy, Romance",105,Kenneth Branagh,Lily James Cate Blanchett Richard Madden Helena Bonham Carter Stellan Skarsg\u00e5rd,0,B,well_known,62.79232112,0,1,0,0,1,lily james cate blanchett richard madden helena bonham carter stellan skarsg\u00e5rd
The Revenant,2015,2015-12-25,183637894,349312609,532950503,135000000,397950503,2.947781504,78,397,"Action & Adventure, Drama",156,"Alejandro González Iñárritu, Manny Palo",Leonardo DiCaprio Tom Hardy Will Poulter Domhnall Gleeson Paul Anderson,0,B,well_known,62.67015707,0,1,0,0,1,leonardo dicaprio tom hardy will poulter domhnall gleeson paul anderson
Ant-Man,2015,2015-07-17,180202163,339109802,519311965,130000000,389311965,2.994707423,83,328,"Action & Adventure, Comedy, Mystery & Suspense, Science Fiction & Fantasy",117,Peyton Reed,Paul Rudd Michael Douglas Evangeline Lilly Corey Stoll Bobby Cannavale,0,B,well_known,61.69284468,0,1,0,0,1,paul rudd michael douglas evangeline lilly corey stoll bobby cannavale
Hotel Transylvania 2,2015,2015-09-25,169700110,305099890,474800000,80000000,394800000,4.935,56,108,Animation,89,Genndy Tartakovsky,Adam Sandler Andy Samberg Selena Gomez Kevin James Steve Buscemi,0,B,well_known,61.20418848,1,0,0,1,0,adam sandler andy samberg selena gomez kevin james steve buscemi
San Andreas,2015,2015-05-29,155190832,319400000,474590832,110000000,364590832,3.314462109,50,245,Action & Adventure,114,Brad Peyton,Dwayne Johnson Alexandra Daddario Carla Gugino Ioan Gruffudd Archie Panjabi,0,B,well_known,61.08202443,0,1,0,0,1,dwayne johnson alexandra daddario carla gugino ioan gruffudd archie panjabi
Terminator Genisys,2015,2015-07-01,89760956,350842581,440603537,155000000,285603537,1.842603465,27,269,Action & Adventure,126,Alan Taylor,Arnold Schwarzenegger Jason Clarke Emilia Clarke Jai Courtney J.K. Simmons,0,B,well_known,60.59336824,0,1,0,0,1,arnold schwarzenegger jason clarke emilia clarke jai courtney j.k. simmons
Kingsman: The Secret Service,2015,2015-02-13,128261724,286089822,414351546,81000000,333351546,4.115451185,74,258,Mystery & Suspense,129,Matthew Vaughn,Colin Firth Taron Egerton Mark Strong Samuel L. Jackson Michael Caine,0,B,well_known,59.4938918,0,1,0,0,1,colin firth taron egerton mark strong samuel l. jackson michael caine
Home,2015,2015-03-26,177397510,208644097,386041607,135000000,251041607,1.859567459,51,137,"Action & Adventure, Animation, Comedy, Kids & Family, Science Fiction & Fantasy",94,Tim Johnson,Jim Parsons Rihanna Steve Martin Jennifer Lopez Matt Jones,0,B,well_known,58.39441536,1,0,0,0,1,jim parsons rihanna steve martin jennifer lopez matt jones
Mad Max: Fury Road,2015,2015-05-15,153636354,225800000,379436354,150000000,229436354,1.529575693,97,422,"Action & Adventure, Science Fiction & Fantasy",120,George Miller,Tom Hardy Charlize Theron Nicholas Hoult Hugh Keays-Byrne Josh Helman,0,B,well_known,58.02792321,0,1,0,0,1,tom hardy charlize theron nicholas hoult hugh keays-byrne josh helman
The Good Dinosaur,2015,2015-11-25,123087120,209120551,332207671,175000000,157207671,0.8983295486,76,215,"Action & Adventure, Animation, Comedy, Kids & Family",92,Peter Sohn,Raymond Ochoa Jack Bright Jeffrey Wright Frances McDormand Maleah Nipay-Padilla,0,B,well_known,56.19546248,1,0,0,0,1,raymond ochoa jack bright jeffrey wright frances mcdormand maleah nipay-padilla
Taken 3,2015,2015-01-09,89256424,237222717,326479141,24000001.5,302479139.5,12.60329669,13,120,Action & Adventure,109,Olivier Megaton,Liam Neeson Maggie Grace Forest Whitaker Famke Janssen Dougray Scott,0,B,well_known,55.95113438,0,1,0,1,0,liam neeson maggie grace forest whitaker famke janssen dougray scott
The SpongeBob Movie: Sponge Out of Water,2015,2015-02-06,162994032,162192000,325186032,74000000,251186032,3.394405838,81,104,"Animation, Comedy, Kids & Family",92,Paul Tibbitt,Tom Kenny Bill Fagerbakke Rodger Bumpass Clancy Brown Carolyn Lawrence,0,B,well_known,55.82897033,1,0,0,0,1,tom kenny bill fagerbakke rodger bumpass clancy brown carolyn lawrence
Maze Runner: The Scorch Trials,2015,2015-09-18,81697192,230598864,312296056,61000000,251296056,4.119607475,46,149,Action & Adventure,131,Wes Ball,Dylan O'Brien Kaya Scodelario Thomas Brodie-Sangster Giancarlo Esposito Aidan Gillen,0,B,well_known,55.21815009,0,1,0,0,1,dylan o'brien kaya scodelario thomas brodie-sangster giancarlo esposito aidan gillen
Pitch Perfect 2,2015,2015-05-15,184296230,102847849,287144079,29000000,258144079,8.901519966,65,216,"Comedy, Musical & Performing Arts",115,Elizabeth Banks,Anna Kendrick Rebel Wilson Hailee Steinfeld Brittany Snow Skylar Astin,0,B,well_known,53.9965096,0,1,0,1,0,anna kendrick rebel wilson hailee steinfeld brittany snow skylar astin
Mojin: The Lost Legend,2015,2015-12-18,1243810,258124638,259368448,37000000,222368448,6.009958054,56,9,Action & Adventure,127,Wuershan,Shin Qi Chen Kun Huang Bo Angelababy Xia Yu,0,B,well_known,53.5078534,0,1,0,0,1,shin qi chen kun huang bo angelababy xia yu
Lost in Hong Kong,2015,2015-09-25,1302281,254981631,256283912,15600000,240683912,15.4284559,60,5,"Art House & International, Comedy",114,Zheng Xu,Xu Zheng Bao Bei'er Zhao Wei Paul Che Sam Lee,0,B,well_known,53.26352531,0,1,0,0,1,xu zheng bao bei'er zhao wei paul che sam lee
The Peanuts Movie,2015,2015-11-06,130178411,116054702,246233113,99000000,147233113,1.487203162,87,197,"Animation, Kids & Family",89,Steve Martino,Noah Schnapp Bill Melendez Venus Schultheis Hadley Belle Miller Madisyn Shipman,0,B,well_known,52.40837696,1,0,0,0,1,noah schnapp bill melendez venus schultheis hadley belle miller madisyn shipman
Pixels,2015,2015-07-24,78747585,166127224,244874809,88000000,156874809,1.782668284,17,201,"Animation, Comedy, Drama",106,Chris Columbus,Adam Sandler Michelle Monaghan Peter Dinklage Josh Gad Kevin James,0,B,well_known,52.16404887,1,0,0,0,1,adam sandler michelle monaghan peter dinklage josh gad kevin james
Daddy's Home,2015,2015-12-25,150357137,92429000,242786137,50000000,192786137,3.85572274,31,121,Comedy,96,"John Morris, Sean Anders",Will Ferrell Mark Wahlberg Linda Cardellini Thomas Haden Church Scarlett Estevez,0,B,well_known,51.91972077,0,1,0,0,1,will ferrell mark wahlberg linda cardellini thomas haden church scarlett estevez
Spy,2015,2015-06-05,110825712,124840507,235666219,65000000,170666219,2.625634138,95,257,Comedy,115,Paul Feig,Melissa McCarthy Jason Statham Rose Byrne Jude Law Bobby Cannavale,0,B,well_known,51.43106457,0,1,0,0,1,melissa mccarthy jason statham rose byrne jude law bobby cannavale
Alvin and the Chipmunks: The Road Chip,2015,2015-12-18,85886987,148911649,234798636,65000000,169798636,2.612286708,15,67,"Animation, Comedy, Kids & Family",86,Walt Becker,Jason Lee Justin Long Bella Thorne Matthew Gray Gubler Jesse McCartney,0,B,well_known,51.30890052,1,0,0,0,1,jason lee justin long bella thorne matthew gray gubler jesse mccartney
Ted 2,2015,2015-06-26,81476385,134387221,215863606,68000000,147863606,2.174464794,45,206,Comedy,115,Seth MacFarlane,Mark Wahlberg Seth MacFarlane Amanda Seyfried Jessica Barth Giovanni Ribisi,0,B,well_known,49.96509599,0,1,0,1,0,mark wahlberg seth macfarlane amanda seyfried jessica barth giovanni ribisi
Tomorrowland,2015,2015-05-22,93436322,115599346,209035668,190000000,19035668,0.1001877263,50,296,Science Fiction & Fantasy,129,Brad Bird,Britt Robertson George Clooney Raffey Cassidy Thomas Robinson Hugh Laurie,0,B,well_known,49.47643979,0,1,0,0,1,britt robertson george clooney raffey cassidy thomas robinson hugh laurie
Everest,2015,2015-09-18,43482270,159945314,203427584,55000000,148427584,2.698683345,73,227,"Action & Adventure, Drama, Mystery & Suspense",121,Baltasar Kormákur,Jason Clarke Jake Gyllenhaal Josh Brolin John Hawkes Sam Worthington,0,C,well_known,48.9877836,0,1,0,0,1,jason clarke jake gyllenhaal josh brolin john hawkes sam worthington
Straight Outta Compton,2015,2015-08-14,161197785,40437206,201634991,28000000,173634991,6.201249679,89,245,"Drama, Musical & Performing Arts",147,F. Gary Gray,O'Shea Jackson Jr. Corey Hawkins Jason Mitchell Neil Brown Jr. Aldis Hodge,0,C,well_known,48.62129145,0,1,0,0,1,o'shea jackson jr. corey hawkins jason mitchell neil brown jr. aldis hodge
The Intern,2015,2015-09-25,75764672,119000000,194764672,35000000,159764672,4.564704914,60,194,Comedy,121,Nancy Meyers,Robert De Niro Anne Hathaway Rene Russo Anders Holm JoJo Kushner,0,C,well_known,47.88830716,0,1,0,0,1,robert de niro anne hathaway rene russo anders holm jojo kushner
Jupiter Ascending,2015,2015-02-06,47387723,136900000,184287723,176000003,8287720,0.04708931738,27,269,"Action & Adventure, Science Fiction & Fantasy",127,"Lana Wachowski, Lilly Wachowski",Mila Kunis Channing Tatum Sean Bean Eddie Redmayne Douglas Booth,0,C,well_known,47.15532286,0,1,0,0,1,mila kunis channing tatum sean bean eddie redmayne douglas booth
Creed,2015,2015-11-25,109767581,64400000,174167581,37000000,137167581,3.707231919,95,306,Drama,133,Ryan Coogler,Michael B. Jordan Sylvester Stallone Graham McTavish Tessa Thompson Phylicia Rash\u0101d,0,C,well_known,46.05584642,0,1,0,0,1,michael b. jordan sylvester stallone graham mctavish tessa thompson phylicia rash\u0101d
Fantastic Four,2015,2015-08-07,56117548,111765333,167882881,120000000,47882881,0.3990240083,9,258,Action & Adventure,100,Josh Trank,Miles Teller Kate Mara Michael B. Jordan Jamie Bell Toby Kebbell,0,C,well_known,44.95636998,0,1,0,0,1,miles teller kate mara michael b. jordan jamie bell toby kebbell
Bridge of Spies,2015,2015-10-16,72313754,93164594,165478348,40000000,125478348,3.1369587,90,307,"Drama, Mystery & Suspense",141,Steven Spielberg,Tom Hanks Mark Rylance Amy Ryan Alan Alda Sebastian Koch,0,C,well_known,44.83420593,0,1,0,0,1,tom hanks mark rylance amy ryan alan alda sebastian koch
Focus,2015,2015-02-27,53862963,105300000,159162963,50100000,109062963,2.176905449,56,225,"Comedy, Drama",,"John Requa, Glenn Ficarra",Will Smith Margot Robbie Rodrigo Santoro Robert Taylor Gerald McRaney,0,C,well_known,44.22338569,0,1,0,0,1,will smith margot robbie rodrigo santoro robert taylor gerald mcraney
Goosebumps,2015,2015-10-16,80080379,78180573,158260952,58000000,100260952,1.728637103,78,163,"Horror, Kids & Family, Mystery & Suspense",103,Rob Letterman,Jack Black Dylan Minnette Odeya Rush Amy Ryan Jillian Bell,0,C,well_known,44.10122164,0,1,0,0,1,jack black dylan minnette odeya rush amy ryan jillian bell
The Hateful Eight,2015,2015-12-30,54117416,101642701,155760117,44000000,111760117,2.540002659,75,332,Western,168,Quentin Tarantino,Samuel L. Jackson Kurt Russell Jennifer Jason Leigh Walton Goggins Demi\u00e1n Bichir,0,C,well_known,43.61256545,0,1,0,0,1,samuel l. jackson kurt russell jennifer jason leigh walton goggins demi\u00e1n bichir
The Last Witch Hunter,2015,2015-10-23,27367660,119569250,146936910,90000000,56936910,0.6326323333,18,136,"Action & Adventure, Science Fiction & Fantasy",106,Breck Eisner,Vin Diesel Rose Leslie Elijah Wood \u00d3lafur Darri \u00d3lafsson Rena Owen,0,C,well_known,42.51308901,0,1,0,0,1,vin diesel rose leslie elijah wood \u00d3lafur darri \u00d3lafsson rena owen
Trainwreck,2015,2015-07-17,110212700,30583093,140795793,35000000,105795793,3.022736943,85,284,Comedy,125,Judd Apatow,Amy Schumer Bill Hader Brie Larson Colin Quinn Vanessa Bayer,0,C,well_known,41.78010471,0,1,0,0,1,amy schumer bill hader brie larson colin quinn vanessa bayer
Point Break,2015,2015-12-25,28782481,105000000,133782481,105000000,28782481,0.2741188667,11,110,Action & Adventure,,Ericson Core,Édgar Ramírez Luke Bracey Teresa Palmer Delroy Lindo Ray Winstone,0,C,well_known,40.92495637,0,1,0,0,1,édgar ramírez luke bracey teresa palmer delroy lindo ray winstone
The Big Short,2015,2015-12-23,70259870,63181000,133440870,28000000,105440870,3.765745357,88,322,Drama,130,Adam McKay,Christian Bale Steve Carell Ryan Gosling Brad Pitt Melissa Leo,0,C,well_known,40.80279232,0,1,0,0,1,christian bale steve carell ryan gosling brad pitt melissa leo
Pan,2015,2015-10-09,35088320,93900000,128988320,150000000,-21011680,-0.1400778667,27,197,"Action & Adventure, Science Fiction & Fantasy",111,Joe Wright,Levi Miller Garrett Hedlund Hugh Jackman Rooney Mara Amanda Seyfried,0,C,well_known,40.31413613,0,1,0,0,1,levi miller garrett hedlund hugh jackman rooney mara amanda seyfried
Wolf Totem,2015,2015-09-11,210591,125626479,125837070,38000000,87837070,2.311501842,67,30,Action & Adventure,118,Jean-Jacques Annaud,Feng Shaofeng Ankhnyam Ragchaa Shawn Dou Baasanjav Mijid Yin Zhusheng,0,C,well_known,39.94764398,0,1,0,0,1,feng shaofeng ankhnyam ragchaa shawn dou baasanjav mijid yin zhusheng
Magic Mike XXL,2015,2015-07-01,66013057,56600000,122613057,14800000,107813057,7.284666014,65,235,Comedy,115,Gregory Jacobs,Channing Tatum Matt Bomer Joe Manganiello Kevin Nash Adam Rodr\u00edguez,0,C,well_known,39.33682373,0,1,0,0,1,channing tatum matt bomer joe manganiello kevin nash adam rodr\u00edguez
Insidious: Chapter 3,2015,2015-06-05,52218558,60765331,112983889,10000000,102983889,10.2983889,57,129,Horror,97,Leigh Whannell,Dermot Mulroney Stefanie Scott Lin Shaye Leigh Whannell Angus Sampson,0,C,well_known,37.62652705,0,1,0,1,0,dermot mulroney stefanie scott lin shaye leigh whannell angus sampson
Get Hard,2015,2015-03-27,90411453,21400000,111811453,40000000,71811453,1.795286325,28,183,Comedy,99,Etan Cohen,Will Ferrell Kevin Hart Alison Brie Craig T. Nelson T.I.,0,C,well_known,37.38219895,0,1,0,0,1,will ferrell kevin hart alison brie craig t. nelson t.i.
The Man from U.N.C.L.E.,2015,2015-08-14,45445109,64600000,110045109,75000000,35045109,0.46726812,67,288,"Action & Adventure, Comedy, Mystery & Suspense",116,Guy Ritchie,Henry Cavill Armie Hammer Alicia Vikander Elizabeth Debicki Luca Calvani,0,C,well_known,37.01570681,0,1,0,0,1,henry cavill armie hammer alicia vikander elizabeth debicki luca calvani
Paul Blart: Mall Cop 2,2015,2015-04-17,71038190,36550035,107588225,38000000,69588225,1.831269079,5,61,"Comedy, Kids & Family",94,Andy Fickman,Kevin James Raini Rodriguez Eduardo Ver\u00e1stegui Daniella Alonso Neal McDonough,0,C,well_known,36.77137871,0,1,0,1,0,kevin james raini rodriguez eduardo ver\u00e1stegui daniella alonso neal mcdonough
Vacation,2015,2015-07-29,58884188,48344033,107228221,31000000,76228221,2.458974871,27,171,"Action & Adventure, Comedy",99,"Jonathan M. Goldstein, John Francis Daley",Ed Helms Christina Applegate Skyler Gisondo Steele Stebbins Chris Hemsworth,0,C,well_known,36.64921466,0,1,0,0,1,ed helms christina applegate skyler gisondo steele stebbins chris hemsworth
Shaun the Sheep Movie,2015,2015-08-05,19375982,86833396,106209378,25000000,81209378,3.24837512,99,169,"Animation, Comedy",85,"Mark Burton, Richard Starzak",Nick Park Will Becher Justin Fletcher Kate Harbour John Sparkes,0,C,well_known,36.52705061,1,0,0,0,1,nick park will becher justin fletcher kate harbour john sparkes
Sisters,2015,2015-12-18,87044645,17966408,105011053,30000000,75011053,2.500368433,60,176,"Comedy, Drama",118,Jason Moore,Tina Fey Amy Poehler Maya Rudolph Paula Pell John Cena,0,C,well_known,36.28272251,0,1,0,0,1,tina fey amy poehler maya rudolph paula pell john cena
Chappie,2015,2015-03-06,31569268,71242621,102811889,49000000,53811889,1.098201816,33,227,Action & Adventure,120,Neill Blomkamp,Sharlto Copley Dev Patel Ninja Yolandi Visser Jose Pablo Cantillo,0,C,well_known,35.79406632,0,1,0,0,1,sharlto copley dev patel ninja yolandi visser jose pablo cantillo
Joy,2015,2015-12-25,56451232,44682827,101134059,60000000,41134059,0.68556765,61,266,Drama,123,David O. Russell,Jennifer Lawrence Bradley Cooper Robert De Niro Dascha Polanco Edgar Ram\u00edrez,0,C,well_known,35.67190227,0,1,0,0,1,jennifer lawrence bradley cooper robert de niro dascha polanco edgar ram\u00edrez
Black Mass,2015,2015-09-18,62575678,37400000,99975678,53000000,46975678,0.8863335472,73,288,Drama,,Scott Cooper,Johnny Depp Joel Edgerton Benedict Cumberbatch Dakota Johnson Kevin Bacon,0,C,well_known,35.30541012,0,1,0,0,1,johnny depp joel edgerton benedict cumberbatch dakota johnson kevin bacon
Spotlight,2015,2015-11-06,45055776,53634478,98690254,20000000,78690254,3.9345127,97,367,"Drama, Mystery & Suspense",128,Tom McCarthy,Mark Ruffalo Michael Keaton Rachel McAdams Liev Schreiber John Slattery,0,C,well_known,35.18324607,0,1,0,0,1,mark ruffalo michael keaton rachel mcadams liev schreiber john slattery
The Visit,2015,2015-09-11,65206105,33243957,98450062,5000000,93450062,18.6900124,68,228,"Horror, Mystery & Suspense",94,M. Night Shyamalan,Olivia DeJonge Ed Oxenbould Kathryn Hahn Benjamin Kanes Deanna Dunagan,0,C,well_known,35.06108202,0,1,0,0,1,olivia dejonge ed oxenbould kathryn hahn benjamin kanes deanna dunagan
Poltergeist,2015,2015-05-22,47425125,48012869,95437994,35000000,60437994,1.726799829,31,134,Horror,93,Gil Kenan,Sam Rockwell Rosemarie DeWitt Kennedi Clements Kyle Catlett Jared Harris,0,C,well_known,34.32809773,0,1,0,0,1,sam rockwell rosemarie dewitt kennedi clements kyle catlett jared harris
Veteran,2015,2015-09-17,1200627,93192393,94393020,5200000,89193020,17.15250385,90,10,Drama,124,Seung-wan Ryoo,Yoo Ah-in Hwang Jung-min Yoo Hae-jin Oh Dal-su Jin Kyung,0,C,well_known,34.08376963,0,1,0,0,1,yoo ah-in hwang jung-min yoo hae-jin oh dal-su jin kyung
In the Heart of the Sea,2015,2015-12-11,25020758,69300000,94320758,100000000,-5679242,-0.05679242,43,237,"Action & Adventure, Drama",116,Ron Howard,Chris Hemsworth Benjamin Walker Cillian Murphy Brendan Gleeson Ben Whishaw,0,C,well_known,33.96160558,0,1,0,0,1,chris hemsworth benjamin walker cillian murphy brendan gleeson ben whishaw
Southpaw,2015,2015-07-24,52421953,39548874,91970827,30000000,61970827,2.065694233,59,237,Drama,123,Antoine Fuqua,Jake Gyllenhaal Rachel McAdams Forest Whitaker Oona Laurence 50 Cent,0,C,well_known,32.98429319,0,1,0,0,1,jake gyllenhaal rachel mcadams forest whitaker oona laurence 50 cent
The Second Best Exotic Marigold Hotel,2015,2015-03-06,33078266,52900000,85978266,10000000,75978266,7.5978266,65,187,Comedy,122,John Madden,Dev Patel Judi Dench Richard Gere Maggie Smith Bill Nighy,0,C,well_known,31.64048866,0,1,0,0,1,dev patel judi dench richard gere maggie smith bill nighy
Paper Towns,2015,2015-07-24,32000304,53511996,85512300,12000000,73512300,6.126025,58,139,Drama,109,Jake Schreier,Nat Wolff Cara Delevingne Justice Smith Austin Abrams Halston Sage,0,C,well_known,31.51832461,0,1,0,0,1,nat wolff cara delevingne justice smith austin abrams halston sage
Sicario,2015,2015-10-02,46889293,37983151,84872444,30000000,54872444,1.829081467,92,272,"Action & Adventure, Drama, Mystery & Suspense",121,Denis Villeneuve,Emily Blunt Benicio del Toro Josh Brolin Victor Garber Jon Bernthal,0,C,well_known,31.15183246,0,1,0,0,1,emily blunt benicio del toro josh brolin victor garber jon bernthal
Hitman: Agent 47,2015,2015-08-21,22467450,59880206,82347656,17500023.5,64847632.5,3.705574024,9,129,Action & Adventure,96,Aleksander Bach,Rupert Friend Hannah Ware Angelababy Zachary Quinto Mona Pirzad,0,C,well_known,30.78534031,0,1,0,0,1,rupert friend hannah ware angelababy zachary quinto mona pirzad
The Wedding Ringer,2015,2015-01-16,64460211,15339669,79799880,23000000,56799880,2.46956,29,111,Comedy,101,Jeremy Garelick,Kevin Hart Josh Gad Kaley Cuoco Olivia Thirlby Alan Ritchson,0,C,well_known,30.17452007,0,1,0,0,1,kevin hart josh gad kaley cuoco olivia thirlby alan ritchson
Paranormal Activity: The Ghost Dimension,2015,2015-10-23,18300124,60603000,78903124,10000000,68903124,6.8903124,14,77,Horror,88,Gregory Plotkin,Chris J. Murray Olivia Taylor Dudley  Chloe Csengery Ivy George Christopher Nicholas Smith,0,C,well_known,29.80802792,0,1,0,0,1,chris j. murray olivia taylor dudley  chloe csengery ivy george christopher nicholas smith
War Room,2015,2015-08-28,67790117,5477757,73267874,3000000,70267874,23.42262467,34,35,Drama,120,Alex Kendrick,Alex Kendrick Karen Abercrombie T.C. Stallings Priscilla Shirer Alena Pitts,0,C,well_known,27.97556719,0,1,0,0,1,alex kendrick karen abercrombie t.c. stallings priscilla shirer alena pitts
The Transporter Refueled,2015,2015-09-04,16029670,56600000,72629670,25000000,47629670,1.9051868,16,101,Action & Adventure,91,Camille Delamarre,Ed Skrein Ray Stevenson Loan Chabanol Gabriella Wright Tatjana Pajkovi\u0107,0,C,well_known,27.85340314,0,1,0,0,1,ed skrein ray stevenson loan chabanol gabriella wright tatjana pajkovi\u0107
Run All Night,2015,2015-03-13,26461644,45200000,71661644,50000000,21661644,0.43323288,59,184,Mystery & Suspense,114,Jaume Collet-Serra,Liam Neeson Ed Harris Joel Kinnaman Boyd Holbrook Bruce McGill,0,C,well_known,27.48691099,0,1,0,0,1,liam neeson ed harris joel kinnaman boyd holbrook bruce mcgill
The Age of Adaline,2015,2015-04-24,42629776,23033500,65663276,25000000,40663276,1.62653104,54,167,"Drama, Science Fiction & Fantasy",113,Lee Toland Krieger,Blake Lively Michiel Huisman Harrison Ford Ellen Burstyn Kathy Baker,0,C,well_known,26.38743455,0,1,0,0,1,blake lively michiel huisman harrison ford ellen burstyn kathy baker
The Danish Girl,2015,2015-11-27,11114018,53077505,64191523,15000000,49191523,3.279434867,67,241,Drama,120,Tom Hooper,Eddie Redmayne Alicia Vikander Amber Heard Emerald Fennell Ben Whishaw,0,C,well_known,25.77661431,0,1,0,0,1,eddie redmayne alicia vikander amber heard emerald fennell ben whishaw
The Boy,2015,2015-08-18,35819556,28368811,64188367,10000000,54188367,5.4188367,67,21,"Drama, Horror, Mystery & Suspense",105,Craig William Macneill,Lauren Cohan James Russell Ben Robson Rupert Evans Diana Hardcastle,0,C,well_known,25.65445026,0,1,0,0,1,lauren cohan james russell ben robson rupert evans diana hardcastle
The Longest Ride,2015,2015-04-10,37446117,25498698,62944815,34000000,28944815,0.8513180882,31,124,Drama,128,George Tillman Jr.,Scott Eastwood Britt Robertson Lolita Davidovich Melissa Benoist Jack Huston,0,C,well_known,25.41012216,0,1,0,0,1,scott eastwood britt robertson lolita davidovich melissa benoist jack huston
