title,year,original_release_date_parsed,domestic_gross,international_gross,worldwide_gross,production_budget,profit_proxy,roi_proxy,tomatometer_rating,tomatometer_count,genres,runtime,directors,lead_actor,lead_actor_has_oscar,lead_actor_tier,lead_actor_status,star_power_score,is_animated,is_live_action,is_franchise,is_sequel,is_standalone,lead_actor_clean
The Big Sick,2017,2017-07-14,42873127,13538458,56411585,5000000,51411585,10.282317,98,299,"Comedy, Romance",120,Michael Showalter,Kumail Nanjiani  Zoe Kazan  Holly Hunter Ray Romano Anupam Kher,0,C,well_known,22.72251309,0,1,0,0,1,kumail nanjiani  zoe kazan  holly hunter ray romano anupam kher
All Eyez on Me,2017,2017-06-16,44922302,10746396,55668698,40000000,15668698,0.39171745,18,91,Drama,140,Benny Boom,Demetrius Shipp Jr. Jamal Woolard Danai Gurira Kat Graham Lauren Cohan,0,C,well_known,22.60034904,0,1,0,0,1,demetrius shipp jr. jamal woolard danai gurira kat graham lauren cohan
Downsizing,2017,2017-12-22,24449754,30554136,55003890,68000000,-12996110,-0.1911192647,46,299,"Comedy, Drama",135,Alexander Payne,Matt Damon Hong Chau Kristen Wiig Christoph Waltz Udo Kier,0,C,well_known,22.23385689,0,1,0,0,1,matt damon hong chau kristen wiig christoph waltz udo kier
Logan Lucky,2017,2017-08-18,27780977,20672628,48453605,29000000,19453605,0.6708139655,92,282,Comedy,119,Steven Soderbergh,Channing Tatum Adam Driver Daniel Craig Riley Keough Hilary Swank,0,C,well_known,19.30191972,0,1,0,0,1,channing tatum adam driver daniel craig riley keough hilary swank
Rough Night,2017,2017-06-16,22105643,25241640,47347283,20000000,27347283,1.36736415,44,169,Comedy,96,Lucia Aniello,Scarlett Johansson Kate McKinnon Jillian BellIlana Glazer  Zoë Kravitz,0,C,well_known,18.69109948,0,1,0,0,1,scarlett johansson kate mckinnon jillian bellilana glazer  zoë kravitz
Flatliners,2017,2017-09-29,16883115,28275139,45158254,26000000,19158254,0.7368559231,4,76,"Drama, Horror, Science Fiction & Fantasy",108,Niels Arden Oplev,Kiefer Sutherland Elliot Page Diego Luna James Norton Nina Dobrev,0,C,well_known,17.71378709,0,1,0,0,1,kiefer sutherland elliot page diego luna james norton nina dobrev
Mother!,2017,2017-09-15,17800004,26716995,44516999,30000000,14516999,0.4838999667,68,374,"Drama, Horror, Mystery & Suspense",120,Darren Aronofsky,Jennifer Lawrence Javier Bardem Sarah-Jeanne Labrosse Stephen McHattie Emily Hampshire,0,C,well_known,17.22513089,0,1,0,0,1,jennifer lawrence javier bardem sarah-jeanne labrosse stephen mchattie emily hampshire
Wind River,2017,2017-08-04,33800859,10179962,43980821,11000000,32980821,2.998256455,88,249,"Drama, Mystery & Suspense",111,Taylor Sheridan,Jeremy Renner Elizabeth Olsen Kelsey Asbille Gil Birmingham Julia Jones,0,C,well_known,16.98080279,0,1,0,0,1,jeremy renner elizabeth olsen kelsey asbille gil birmingham julia jones
The Snowman,2017,2017-10-20,6700035,36384025,43084060,35000000,8084060,0.2309731429,7,196,"Drama, Mystery & Suspense",119,Tomas Alfredson,Michael Fassbender Rebecca Ferguson Val Kilmer Chloë Sevigny Toby Jones,0,C,well_known,16.4921466,0,1,0,0,1,michael fassbender rebecca ferguson val kilmer chloë sevigny toby jones
Gifted,2017,2017-04-07,24801212,18245378,43046590,7000000,36046590,5.149512857,73,179,Drama,101,Marc Webb,Chris Evans  Mckenna Grace Lindsay Duncan Jenny Slate Octavia Spencer,0,C,well_known,16.2478185,0,1,0,0,1,chris evans  mckenna grace lindsay duncan jenny slate octavia spencer
Loving Vincent,2017,2017-09-22,6735118,35452547,42187665,5500000,36687665,6.670484545,85,158,"Animation, Drama",95,"Dorota Kobiela, Hugh Welchman",Robert Gulaczyk Douglas Booth Saoirse Ronan Aidan Turner Chris O'Dowd,0,C,well_known,15.51483421,1,0,0,0,1,robert gulaczyk douglas booth saoirse ronan aidan turner chris o'dowd
T2 Trainspotting,2017,2017-03-17,2402004,39279742,41681746,9000001,32681745,3.631304597,81,249,Drama,117,Danny Boyle,Ewan McGregor Jonny Lee Miller Ewen Bremner Robert Carlyle Kelly Macdonald,0,C,well_known,15.39267016,0,1,0,0,1,ewan mcgregor jonny lee miller ewen bremner robert carlyle kelly macdonald
Fist Fight,2017,2017-02-17,32187017,9000000,41187017,23500000,17687017,0.7526390213,24,131,Comedy,91,Richie Keen,Charlie Day Ice Cub Tracy Morgan Jillian Bell Christina Hendricks,0,C,well_known,14.78184991,0,1,0,0,1,charlie day ice cub tracy morgan jillian bell christina hendricks
The Circle,2017,2017-04-28,20497844,20158555,40656399,18000000,22656399,1.258688833,15,142,"Drama, Mystery & Suspense",110,James Ponsoldt,Tom Hanks Emma Watson Bill Paxton John Boyega Karen Gillan,0,C,well_known,14.41535777,0,1,0,0,1,tom hanks emma watson bill paxton john boyega karen gillan
Diary of a Wimpy Kid: The Long Haul,2017,2017-05-19,20738724,19402248,40140972,22000000,18140972,0.8245896364,18,72,"Comedy, Kids & Family",91,David Bowers,Jason Drucker Charlie Wright Alicia Silverstone  Tom Everett Scott Owen Asztalos,0,C,well_known,14.04886562,0,1,0,0,1,jason drucker charlie wright alicia silverstone  tom everett scott owen asztalos
Pokémon the Movie: I Choose You!,2017,2017-11-05,2401722,35150422,37552144,13000000,24552144,1.888626462,33,9,"Comedy, Kids & Family",98,Kunihiko Yuyama,Ikue Ōtani Shin-ichiro Miki Rica Matsumoto Unshō Ishizuka Koichi Yamader,0,C,well_known,12.94938918,0,1,0,0,1,ikue ōtani shin-ichiro miki rica matsumoto unshō ishizuka koichi yamader
Home Again,2017,2017-09-08,27020284,10250437,37270721,12000000,25270721,2.105893417,32,138,Comedy,97,Hallie Meyers-Shyer,Reese Witherspoon Pico Alexander Candice Bergen Michael Sheen Jon Rudnitsky,0,C,well_known,12.58289703,0,1,0,0,1,reese witherspoon pico alexander candice bergen michael sheen jon rudnitsky
The Adventurers,2017,2017-08-18,216556,36580260,36796816,21840000,14956816,0.6848358974,14,7,Action & Adventure,104,Stephen Fung,Andy Lau Jean Reno Shu Qi Jingchu Zhang Tony Yang,0,C,well_known,12.33856894,0,1,0,0,1,andy lau jean reno shu qi jingchu zhang tony yang
Kidnap,2017,2017-08-04,30971040,3843062,34814102,21000000,13814102,0.657814381,36,92,"Action & Adventure, Drama, Mystery & Suspense",82,Luis Prieto,Halle Berry Sage Correa  Alan Abeyta Molly Conarro Andy Abele,0,C,well_known,11.36125654,0,1,0,0,1,halle berry sage correa  alan abeyta molly conarro andy abele
The House,2017,2017-06-30,25584504,8700000,34284504,40000000,-5715496,-0.1428874,20,81,Comedy,88,Andrew Jay Cohen,Will Ferrell Amy Poehler Ryan Simpkins Jason Mantzoukas Andrea Savage,0,C,well_known,11.11692845,0,1,0,0,1,will ferrell amy poehler ryan simpkins jason mantzoukas andrea savage
Sleepless,2017,2017-01-13,20783704,12133649,32917353,30000000,2917353,0.0972451,25,61,"Action & Adventure, Drama, Mystery & Suspense",95,Baran bo Odar,Jamie Foxx Michelle Monaghan Gabrielle Union David Harbour Dermot Mulroney,0,C,well_known,10.38394415,0,1,0,0,1,jamie foxx michelle monaghan gabrielle union david harbour dermot mulroney
The Bye Bye Man,2017,2017-01-13,22395806,7478474,29874280,7400000,22474280,3.037064865,19,89,Horror,96,Stacy Title,Douglas Smith Doug Jones Jenna Kanell Carrie-Anne Moss Faye Dunaway,0,C,well_known,8.062827225,0,1,0,0,1,douglas smith doug jones jenna kanell carrie-anne moss faye dunaway
The Disaster Artist,2017,2017-12-08,21120616,8700000,29820616,10000000,19820616,1.9820616,91,345,Comedy,103,James Franco,James Franco Tommy Wiseau Dave Franco Seth Rogen Josh Hutcherson,0,C,well_known,7.940663176,0,1,0,0,1,james franco tommy wiseau dave franco seth rogen josh hutcherson
What Happened to Monday,2017,2017-08-18,0,27975429,27975429,20000000,7975429,0.39877145,58,36,"Action & Adventure, Drama, Mystery & Suspense, Science Fiction & Fantasy",123,Tommy Wirkola,Noomi Rapace Willem Dafoe Glenn Close Marwan Kenzari Cassie Clare,0,C,well_known,6.841186736,0,1,0,0,1,noomi rapace willem dafoe glenn close marwan kenzari cassie clare
The Beguiled,2017,2017-06-30,10709995,17159134,27869129,10000000,17869129,1.7869129,79,322,Drama,94,Sofia Coppola,Kirsten Dunst Nicole Kidman Elle Fanning Emma Howard Angourie Rice,0,C,well_known,6.596858639,0,1,0,0,1,kirsten dunst nicole kidman elle fanning emma howard angourie rice
CHIPS,2017,2017-03-24,18600152,8200000,26800152,25000000,1800152,0.07200608,18,111,"Action & Adventure, Comedy, Drama",101,Dax Shepard,Dax Shepard Michael Peña Erik Estrada Kristen Bell Vincent D'Onofrio,0,C,well_known,5.986038394,0,1,0,0,1,dax shepard michael peña erik estrada kristen bell vincent d'onofrio
A Cure for Wellness,2017,2017-02-17,8106986,18513016,26620002,40000000,-13379998,-0.33449995,42,208,Mystery & Suspense,140,Gore Verbinski,Dane DeHaan Mia Goth Jason Isaacs Celia Imrie Harry Groener,0,C,well_known,5.863874346,0,1,0,0,1,dane dehaan mia goth jason isaacs celia imrie harry groener
Only the Brave,2017,2017-10-20,18343983,8007339,26351322,38000000,-11648678,-0.3065441579,87,163,"Action & Adventure, Drama",134,Joseph Kosinski,Josh Brolin Miles Teller Jeff Bridges Jennifer Connelly Taylor Kitsch,0,C,well_known,5.497382199,0,1,0,0,1,josh brolin miles teller jeff bridges jennifer connelly taylor kitsch
The Zookeeper's Wife,2017,2017-03-31,17571660,8581175,26152835,20000000,6152835,0.30764175,63,178,Drama,125,Niki Caro,Jessica Chastain Daniel Brühl Johan Heldenbergh Val Maloku Shira Haas,0,C,well_known,5.253054101,0,1,0,0,1,jessica chastain daniel brühl johan heldenbergh val maloku shira haas
Father Figures,2017,2017-12-22,17501244,8200000,25701244,25000000,701244,0.02804976,17,48,Comedy,113,Lawrence Sher,Owen Wilson Ed Helms Glenn Close J. K. Simmons Christopher Walken,0,C,well_known,4.520069808,0,1,0,0,1,owen wilson ed helms glenn close j. k. simmons christopher walken
Wish Upon,2017,2017-07-14,14301505,9167081,23468586,12000000,11468586,0.9557155,19,94,Horror,89,John R. Leonetti,Joey King Ryan Phillippe Ki Hong Lee Sydney Park Shannon Purser,0,C,well_known,2.931937173,0,1,0,0,1,joey king ryan phillippe ki hong lee sydney park shannon purser
Detroit,2017,2017-08-04,16790139,6564961,23355100,34000000,-10644900,-0.3130852941,82,300,"Drama, Mystery & Suspense",143,Kathryn Bigelow,Will Poulter Nathan Davis Jr John Boyega Hannah Murray Kaitlyn Dever,0,C,well_known,2.809773124,0,1,0,0,1,will poulter nathan davis jr john boyega hannah murray kaitlyn dever
The Glass Castle,2017,2017-08-11,17273059,4815474,22088533,9000000,13088533,1.454281444,52,164,Drama,127,Destin Daniel Cretton,Brie Larson Woody Harrelson Naomi Watts Sadie Sink Ella Anderson,0,C,well_known,1.832460733,0,1,0,0,1,brie larson woody harrelson naomi watts sadie sink ella anderson
Avengers: Infinity War,2018,2018-04-27,678815482,1369544272,2048359754,312500000,1735859754,5.554751213,85,472,"Action & Adventure, Science Fiction & Fantasy",149,Anthony Russo,Robert Downey Jr Chris Evans Chris Hemsworth Mark Ruffalo Scarlett Johansson Josh Brolin,0,A,trending,70,0,1,1,0,0,robert downey jr chris evans chris hemsworth mark ruffalo scarlett johansson josh brolin
Black Panther,2018,2018-02-16,700059566,646853595,1346913161,200000000,1146913161,5.734565805,96,512,"Action & Adventure, Drama, Science Fiction & Fantasy",134,Ryan Coogler,Chadwick Boseman Michael B. Jordan Danai Gurira Letitia Wright Lupita Nyong'o,0,A,trending,69.02268761,0,1,0,0,1,chadwick boseman michael b. jordan danai gurira letitia wright lupita nyong'o
Jurassic World: Fallen Kingdom,2018,2018-06-22,417719760,890748184,1308467944,170000000,1138467944,6.696870259,47,422,"Action & Adventure, Drama, Science Fiction & Fantasy",128,J.A. Bayona,Chris Pratt Bryce Dallas Howard Jeff Goldblum Daniella Pineda Isabella Sermon,0,A,trending,68.90052356,0,1,1,0,0,chris pratt bryce dallas howard jeff goldblum daniella pineda isabella sermon
Incredibles 2,2018,2018-06-15,608581744,634223615,1242805359,100000001,1142805358,11.42805347,93,379,"Action & Adventure, Animation, Kids & Family",118,Brad Bird,Holly Hunter Craig T. Nelson Huck Milner Sarah Vowell,0,A,trending,68.65619546,1,0,0,1,0,holly hunter craig t. nelson huck milner sarah vowell
Bohemian Rhapsody,2018,2018-11-02,216428042,687227217,903655259,52000000,851655259,16.37798575,60,403,Drama,135,Bryan Singer,Rami Malek Ben Hardy Gwilym Lee Joseph Mazzello Lucy Boynton Aidan Gillen,0,A,trending,66.94589878,0,1,0,0,1,rami malek ben hardy gwilym lee joseph mazzello lucy boynton aidan gillen
Venom,2018,2018-10-05,213515506,642569645,856085151,116000000,740085151,6.380044405,30,349,"Action & Adventure, Drama, Science Fiction & Fantasy",112,Ruben Fleischer,Tom Hardy Michelle Williams Riz Ahmed Woody Harrelson Jenny Slate,0,A,trending,66.09075044,0,1,0,0,1,tom hardy michelle williams riz ahmed woody harrelson jenny slate
Mission: Impossible - Fallout,2018,2018-07-27,220159104,570956000,791115104,178000000,613115104,3.444466876,97,428,"Action & Adventure, Drama, Mystery & Suspense",147,Christopher McQuarrie,Tom Cruise Rebecca Ferguson Simon Pegg Henry Cavill Ving Rhames,0,A,trending,65.47993019,0,1,1,0,0,tom cruise rebecca ferguson simon pegg henry cavill ving rhames
Deadpool 2,2018,2018-05-18,318491426,416055185,734546611,55000001,679546610,12.35539268,83,412,"Action & Adventure, Comedy",120,David Leitch,Ryan Reynolds Josh Brolin Zazie Beetz Julian Dennison Fred Savage,0,A,trending,64.991274,0,1,0,1,0,ryan reynolds josh brolin zazie beetz julian dennison fred savage
Fantastic Beasts: The Crimes of Grindelwald,2018,2018-11-16,159555901,496200000,655755901,200000000,455755901,2.278779505,36,323,"Action & Adventure, Kids & Family, Science Fiction & Fantasy",134,David Yates (II),Eddie Redmayne Johnny Depp Jude Law Katherine Waterston Ezra Miller,0,A,trending,64.38045375,0,1,0,0,1,eddie redmayne johnny depp jude law katherine waterston ezra miller
Ant-Man and the Wasp,2018,2018-07-06,216648740,406025399,622674139,388000000,234674139,0.6048302552,87,426,"Action & Adventure, Comedy, Science Fiction & Fantasy",118,Peyton Reed,"Paul Rudd Evangeline Lilly Michelle Pfeiffer Michael Douglas Hannah John-Kamen 
",0,A,trending,63.76963351,0,1,0,0,1,paul rudd evangeline lilly michelle pfeiffer michael douglas hannah john-kamen
Ready Player One,2018,2018-03-29,137690172,445800000,583490172,175000000,408490172,2.334229554,72,433,"Action & Adventure, Science Fiction & Fantasy",140,Steven Spielberg,Tye Sheridan Olivia Cooke Mark Rylance Ben Mendelsohn Win Morisaki,0,A,trending,63.40314136,0,1,0,0,1,tye sheridan olivia cooke mark rylance ben mendelsohn win morisaki
Operation Red Sea,2018,2018-02-23,1543547,577786879,579330426,70000000,509330426,7.276148943,80,10,Action & Adventure,139,Dante Lam,Jiang Luxia Johnny Huang Zhang Yi Simon Yam Hanyu Zhang,0,A,trending,63.28097731,0,1,0,0,1,jiang luxia johnny huang zhang yi simon yam hanyu zhang
Ralph Breaks the Internet,2018,2018-11-21,201091711,328232251,529323962,175000000,354323962,2.024708354,88,272,"Animation, Comedy, Kids & Family, Science Fiction & Fantasy",112,"Phil Johnston, Rich Moore",John C. Reilly Sarah Silverman Jane Lynch  Alan Tudyk Jack McBrayer,0,B,trending,62.54799302,1,0,0,0,1,john c. reilly sarah silverman jane lynch  alan tudyk jack mcbrayer
The Meg,2018,2018-08-10,145443742,383800000,529243742,130000000,399243742,3.071105708,46,300,"Action & Adventure, Horror, Science Fiction & Fantasy",113,Jon Turteltaub,Jason Statham Li Bingbing Ruby Rose Rainn Wilson Jessica McNamee,0,B,trending,62.42582897,0,1,0,0,1,jason statham li bingbing ruby rose rainn wilson jessica mcnamee
Hotel Transylvania 3: Summer Vacation,2018,2018-07-13,167510016,361073758,528583774,40000001.5,488583772.5,12.21459385,62,118,"Animation, Comedy, Kids & Family",97,Genndy Tartakovsky,Andy Samberg Adam Sandler Genndy Tartakovsky Selena Gomez Kathryn Hahn,0,B,trending,62.30366492,1,0,0,1,0,andy samberg adam sandler genndy tartakovsky selena gomez kathryn hahn
The Grinch,2018,2018-11-09,271478510,240975007,512453517,75000000,437453517,5.83271356,60,190,"Animation, Kids & Family, Science Fiction & Fantasy",86,"Scott Mosier, Yarrow Cheney",Benedict Cumberbatch Cameron Seely Rashida Jones Mindy Sterling Pharrell William,0,B,trending,61.57068063,1,0,0,0,1,benedict cumberbatch cameron seely rashida jones mindy sterling pharrell william
Bumblebee,2018,2018-12-21,127195589,340794056,467989645,135000000,332989645,2.466589963,91,244,"Action & Adventure, Science Fiction & Fantasy",114,Travis Knight,Hailee Steinfeld Gracie Dzienny Jason Drucker John Cena Peter Cullen,0,B,trending,60.83769634,0,1,0,0,1,hailee steinfeld gracie dzienny jason drucker john cena peter cullen
A Star Is Born,2018,2018-10-05,215288866,221100000,436388866,36000000,400388866,11.12191294,90,517,Drama,135,Bradley Cooper,Bradley Cooper Lady Gaga Sam Elliott Anthony Ramos Rafi Gavron,0,B,trending,60.34904014,0,1,0,0,1,bradley cooper lady gaga sam elliott anthony ramos rafi gavron
Rampage,2018,2018-04-13,101028233,327100000,428128233,120000000,308128233,2.567735275,51,275,"Action & Adventure, Drama, Science Fiction & Fantasy",107,Brad Peyton,Dwayne Johnson Malin Akerman Jeffrey Dean Morgan Naomie Harris,0,B,trending,59.98254799,0,1,0,0,1,dwayne johnson malin akerman jeffrey dean morgan naomie harris
Mamma Mia! Here We Go Again,2018,2018-07-20,120634935,274409771,395044706,75000000,320044706,4.267262747,79,274,"Comedy, Musical & Performing Arts",114,Ol Parker,Meryl Streep Amanda Seyfried Pierce Brosnan Colin Firth Christine Baranski,0,B,trending,58.88307155,0,1,0,0,1,meryl streep amanda seyfried pierce brosnan colin firth christine baranski
Solo: A Star Wars Story,2018,2018-05-25,213767512,179157295,392924807,250000000,142924807,0.571699228,70,474,"Action & Adventure, Drama, Science Fiction & Fantasy",135,Ron Howard,Alden Ehrenreich Emilia Clarke Donald Glover Woody Harrelson Thandiwe Newton,0,B,trending,58.7609075,0,1,1,0,0,alden ehrenreich emilia clarke donald glover woody harrelson thandiwe newton
Spider-Man: Into the Spider-Verse,2018,2018-12-14,190241310,185341327,375582637,90000000,285582637,3.173140411,97,383,"Action & Adventure, Animation, Kids & Family, Science Fiction & Fantasy",117,"Bob Persichetti, Peter Ramsey, Rodney Rothman",Shameik Moore  Jake Johnson  Hailee Steinfeld  Mahershala Ali  Brian Tyree Henry Lily Tomlin,0,B,trending,57.90575916,1,0,1,0,0,shameik moore  jake johnson  hailee steinfeld  mahershala ali  brian tyree henry lily tomlin
Fifty Shades Freed,2018,2018-02-09,100407760,271577258,371985018,55000000,316985018,5.763363964,11,192,Drama,105,James Foley,Dakota Johnson Jamie Dornan Luke Grimes Arielle Kebbel,0,B,trending,57.78359511,0,1,0,0,1,dakota johnson jamie dornan luke grimes arielle kebbel
The Nun,2018,2018-09-07,117450119,248600000,366050119,22000000,344050119,15.63864177,25,202,Horror,96,Corin Hardy,Taissa Farmiga Bonnie Aarons Jonas Bloquet Demián Bichir Vera Farmiga,0,B,trending,57.66143106,0,1,0,0,1,taissa farmiga bonnie aarons jonas bloquet demián bichir vera farmiga
Peter Rabbit,2018,2018-02-09,115253424,236013009,351266433,50000000,301266433,6.02532866,63,146,"Action & Adventure, Animation, Comedy, Kids & Family",95,Will Gluck,James Corden  Domhnall Gleeson Rose Byrne Margot Robbie Daisy Ridley,0,B,trending,56.92844677,1,0,0,0,1,james corden  domhnall gleeson rose byrne margot robbie daisy ridley
A Quiet Place,2018,2018-04-06,188024361,152915000,340939361,17000000,323939361,19.05525653,96,373,"Drama, Horror, Mystery & Suspense",90,John Krasinski,John Krasinski Emily Blunt Millicent Simmonds Noah Jupe Djimon Hounsou,0,B,trending,56.43979058,0,1,0,0,1,john krasinski emily blunt millicent simmonds noah jupe djimon hounsou
Green Book,2018,2018-11-21,85080171,236672485,321752656,23000000,298752656,12.98924591,77,354,Drama,130,Peter Farrelly,Viggo Mortensen Mahershala Ali  Nick Vallelonga Linda Cardellini Dimiter D. Marinov,0,B,trending,55.70680628,0,1,0,0,1,viggo mortensen mahershala ali  nick vallelonga linda cardellini dimiter d. marinov
Skyscraper,2018,2018-07-13,68420120,236448841,304868961,125000000,179868961,1.438951688,48,286,"Action & Adventure, Drama",102,Rawson Marshall Thurber,"Dwayne Johnson Neve Campbell Chin Han Pablo Schreiber McKenna Roberts
",0,B,trending,54.72949389,0,1,0,0,1,dwayne johnson neve campbell chin han pablo schreiber mckenna roberts
Maze Runner: The Death Cure,2018,2018-01-26,58032443,230142892,288175335,62000000,226175335,3.647989274,43,169,"Action & Adventure, Drama, Science Fiction & Fantasy",142,Wes Ball,Dylan O'Brien Thomas Brodie-Sangster Kaya Scodelario Ki Hong Lee Will Poulter,0,B,trending,54.11867365,0,1,0,0,1,dylan o'brien thomas brodie-sangster kaya scodelario ki hong lee will poulter
Tomb Raider,2018,2018-03-16,58250803,216700000,274950803,90000000,184950803,2.055008922,51,315,"Action & Adventure, Drama, Science Fiction & Fantasy",118,Roar Uthaug,Alicia Vikander Daniel Wu Walton Goggins Dominic West Alexandre Willaume,0,B,trending,53.7521815,0,1,0,0,1,alicia vikander daniel wu walton goggins dominic west alexandre willaume
Halloween,2018,2018-10-19,159342015,96143163,255485178,10000000,245485178,24.5485178,79,371,Horror,106,David Gordon Green,Jamie Lee Curtis James Jude Courtney Andi Matichak  Nick Castle Judy Greer,0,B,trending,53.01919721,0,1,0,0,1,jamie lee curtis james jude courtney andi matichak  nick castle judy greer
Crazy Rich Asians,2018,2018-08-15,174532921,64500000,239032921,30000000,209032921,6.967764033,91,352,Comedy,120,Jon M. Chu,Constance Wu Henry Golding Gemma Chan Ken Jeong Harry Shum Jr,0,B,trending,51.55322862,0,1,0,0,1,constance wu henry golding gemma chan ken jeong harry shum jr
Smallfoot,2018,2018-09-28,83240103,134700000,217940103,80000000,137940103,1.724251288,75,126,"Action & Adventure, Animation, Comedy, Kids & Family",96,Karey Kirkpatrick,Channing Tatum Zendaya Gina Rodriguez James Corden Danny DeVito,0,B,trending,50.33158813,1,0,0,0,1,channing tatum zendaya gina rodriguez james corden danny devito
Creed II,2018,2018-11-21,115715889,98500000,214215889,50000000,164215889,3.28431778,83,303,"Action & Adventure, Drama, Sports & Fitness",130,Steven Caple Jr.,Michael B. Jordan Sylvester Stallone Florian Munteanu Dolph Lundgren Tessa Thompson,0,B,trending,49.84293194,0,1,0,1,0,michael b. jordan sylvester stallone florian munteanu dolph lundgren tessa thompson
Us and Them,2018,2018-03-16,0,209221380,209221380,20000000,189221380,9.461069,60,20,"Art House & International, Horror, Mystery & Suspense",83,Joseph Martin,Zhou Dongyu Boran Jing Tian Zhuangzhuang Li Dong Liu Qiheng,0,B,trending,49.59860384,0,1,0,0,1,zhou dongyu boran jing tian zhuangzhuang li dong liu qiheng
Christopher Robin,2018,2018-08-03,99215042,98529335,197744377,75000000,122744377,1.636591693,73,270,"Action & Adventure, Comedy, Kids & Family",104,Marc Forster,Ewan McGregor Jim Cummings Hayley Atwell Bronte Carmichael Brad Garrett,0,C,trending,48.4991274,0,1,0,0,1,ewan mcgregor jim cummings hayley atwell bronte carmichael brad garrett
The Mule,2018,2018-12-14,103804407,71000000,174804407,50000000,124804407,2.49608814,70,189,"Drama, Mystery & Suspense",116,Clint Eastwood,Clint Eastwood Bradley Cooper Alison Eastwood Dianne Wiest Andy Garcia,0,C,trending,46.17801047,0,1,0,0,1,clint eastwood bradley cooper alison eastwood dianne wiest andy garcia
The Nutcracker and the Four Realms,2018,2018-11-02,54858851,119102218,173961069,126500000,47461069,0.3751863162,32,202,"Action & Adventure, Kids & Family, Science Fiction & Fantasy",99,"Lasse Hallstrom, Joe Johnston",Mackenzie Foy Keira Knightley Misty Copeland Jayden Fowora-Knight Jayden Fowora-Knight,0,C,trending,45.93368237,0,1,0,0,1,mackenzie foy keira knightley misty copeland jayden fowora-knight jayden fowora-knight
Insidious: The Last Key,2018,2018-01-05,67745330,100140258,167885588,10000000,157885588,15.7885588,33,111,Horror,103,Adam Robitel,Leigh Whannell Lin Shaye Angus Sampson Bruce Davison Kirk Acevedo,0,C,trending,45.07853403,0,1,0,0,1,leigh whannell lin shaye angus sampson bruce davison kirk acevedo
The Predator,2018,2018-09-14,51024708,109517426,160542134,88000000,72542134,0.8243424318,32,288,"Action & Adventure, Horror, Science Fiction & Fantasy",106,Shane Black,Boyd Holbrook Olivia Munn Jacob Tremblay Brian A. Prince Trevante Rhodes,0,C,trending,44.46771379,0,1,0,0,1,boyd holbrook olivia munn jacob tremblay brian a. prince trevante rhodes
Red Sparrow,2018,2018-03-02,46874505,104698129,151572634,69000000,82572634,1.196704841,45,296,"Action & Adventure, Drama, Mystery & Suspense",139,Francis Lawrence,Jennifer Lawrence Joel Edgerton Matthias Schoenaerts Charlotte Rampling Jeremy Irons,0,C,trending,43.12390925,0,1,0,0,1,jennifer lawrence joel edgerton matthias schoenaerts charlotte rampling jeremy irons
The First Purge,2018,2018-07-04,69488745,67567517,137056262,13000000,124056262,9.542789385,56,171,Horror,97,Gerard McMurray,Y'lan Noel Lex Scott Davis Luna Lauren Velez Mo McRae Rotimi Paul,0,C,trending,41.29144852,0,1,0,0,1,y'lan noel lex scott davis luna lauren velez mo mcrae rotimi paul
A Wrinkle in Time,2018,2018-03-09,100478608,32197256,132675864,51501009,81174855,1.576179896,42,334,"Action & Adventure, Drama, Kids & Family, Science Fiction & Fantasy",109,Ava DuVernay,Storm Reid Oprah Winfrey Reese Witherspoon Mindy Kaling Chris Pine,0,C,trending,40.68062827,0,1,0,0,1,storm reid oprah winfrey reese witherspoon mindy kaling chris pine
The House with a Clock in Its Walls,2018,2018-09-21,68549695,62907452,131457147,42000000,89457147,2.129932071,66,215,"Comedy, Kids & Family, Science Fiction & Fantasy",105,Eli Roth,Jack Black Eli Roth Cate Blanchett Owen Vaccaro Kyle MacLachlan,0,C,trending,40.55846422,0,1,0,0,1,jack black eli roth cate blanchett owen vaccaro kyle maclachlan
Instant Family,2018,2018-11-16,67363237,53192964,120556201,48000000,72556201,1.511587521,80,152,Comedy,119,Sean Anders,Mark Wahlberg Rose Byrne Isabela Merced Octavia Spencer Gustavo Escobar,0,C,trending,38.97033159,0,1,0,0,1,mark wahlberg rose byrne isabela merced octavia spencer gustavo escobar
